{
  "inventory_version": "1.0",
  "inventory_name": "regulated_agentic_ai_inventory",
  "description": "Inventory of AI-enabled products/functions for Agentic and MCP-enabled ecosystems in regulated data industries.",
  "products": [
    {
      "product_name": "gateway",
      "display_name": "AI Gateway",
      "domain": "governance",
      "description": "Centralized control point between users, agents, tools and AI models.",
      "reference_implementations": [
        {
          "name": "Trustbolt",
          "vendor": "Trustbolt",
          "implementation_type": "commercial",
          "deployment_models": [
            "saas",
            "private_cloud"
          ],
          "url": "https://www.trustbolt.ai",
          "notes": "Enterprise AI gateway with prompt controls, entitlements and cost management."
        },
        {
          "name": "LiteLLM",
          "vendor": "BerriAI",
          "implementation_type": "open_source",
          "deployment_models": [
            "self_hosted",
            "api"
          ],
          "url": "https://www.litellm.ai",
          "notes": "Open source LLM gateway and proxy framework."
        },
        {
          "name": "Portkey",
          "vendor": "Portkey",
          "implementation_type": "commercial",
          "deployment_models": [
            "saas",
            "managed_cloud"
          ],
          "url": "https://portkey.ai",
          "notes": "Commercial AI gateway and observability platform."
        }
      ],
      "capabilities": [
        {
          "capability_name": "model_routing",
          "display_name": "Model Routing",
          "description": "Routes requests to approved AI models based on policy, user, workload or cost.",
          "regulated_relevance": "Ensures users and agents only access approved models.",
          "required": true
        },
        {
          "capability_name": "prompt_controls",
          "display_name": "Prompt Controls",
          "description": "Applies enterprise prompt rules before requests are sent to AI models.",
          "regulated_relevance": "Reduces the risk of unsafe, non-compliant or unauthorized AI usage.",
          "required": true
        },
        {
          "capability_name": "cost_tracking",
          "display_name": "Cost Tracking",
          "description": "Tracks AI model usage and cost across users, tools, agents and departments.",
          "regulated_relevance": "Supports financial control, budgeting and operational oversight.",
          "required": true
        }
      ],
      "tags": [
        "agentic",
        "mcp",
        "regulated",
        "finance"
      ]
    },
    {
      "product_name": "retrieval",
      "display_name": "Knowledge Retrieval",
      "domain": "knowledge",
      "description": "Search and retrieval layer that allows agents and assistants to access approved enterprise knowledge.",
      "reference_implementations": [
        {
          "name": "Azure AI Search",
          "vendor": "Microsoft",
          "implementation_type": "cloud_service",
          "deployment_models": [
            "managed_cloud",
            "api"
          ],
          "url": "https://azure.microsoft.com/products/ai-services/ai-search",
          "notes": "Managed enterprise search service with vector and hybrid retrieval capabilities."
        },
        {
          "name": "OpenSearch",
          "vendor": "OpenSearch Project",
          "implementation_type": "open_source",
          "deployment_models": [
            "self_hosted",
            "managed_cloud"
          ],
          "url": "https://opensearch.org",
          "notes": "Open source search and analytics engine."
        }
      ],
      "capabilities": [
        {
          "capability_name": "semantic_search",
          "display_name": "Semantic Search",
          "description": "Finds relevant content using meaning-based search rather than only exact keyword matching.",
          "regulated_relevance": "Improves agent access to approved and relevant knowledge sources.",
          "required": true
        },
        {
          "capability_name": "citation_generation",
          "display_name": "Citation Generation",
          "description": "Returns source references alongside retrieved content.",
          "regulated_relevance": "Supports traceability, review and auditability of AI-generated answers.",
          "required": true
        }
      ],
      "tags": [
        "rag",
        "knowledge",
        "agentic",
        "finance"
      ]
    }
  ]
}